{
  "specVersion": "1.0",
  "eventId": "11111111-1111-4111-8111-111111111111",
  "correlationId": "22222222-2222-4222-8222-222222222222",
  "eventType": "deployment.plan.created",
  "source": "github",
  "subject": "M0nado/helios-platform azure-dev what-if",
  "occurredAt": "2026-07-17T00:00:00Z",
  "environment": "prod",
  "severity": "notice",
  "sensitivity": "confidential",
  "summary": "Synthetic deployment plan used only for offline routing validation.",
  "provenance": {
    "repository": "M0nado/helios-platform",
    "commitSha": "bd1120c57af7c19eb8687d22e9124e4e692e15dd",
    "ref": "refs/heads/integration/helios-chatgpt-copilot-app",
    "workflow": "HELIOS Fabric CI",
    "workflowRunId": "offline-fixture",
    "actor": "fabricctl",
    "idempotencyKey": "fixture:deployment-plan:2026-07-17",
    "contentSha256": "0000000000000000000000000000000000000000000000000000000000000000"
  },
  "payload": {
    "mode": "what-if",
    "apply": false,
    "planHash": "fixture-only"
  },
  "requestedActions": [
    "approve",
    "archive",
    "notify"
  ],
  "links": [
    {
      "label": "Draft PR #177",
      "url": "https://github.com/M0nado/helios-platform/pull/177"
    }
  ],
  "approval": {
    "policyId": "prod-deploy-v1",
    "required": 2,
    "state": "pending",
    "records": []
  }
}

